{
  "$schema": "https://aigovernanceengineer.com/schemas/policy-card.v1.json",
  "card_id": "pc-custom-rule",
  "version": "1.0.0",
  "title": "Custom rule",
  "owner": "ai-governance-engineering",
  "applies_to": [
    "system:*"
  ],
  "source_policy": "ai-policy.yaml#rules/classify-at-intake",
  "rules": [
    {
      "rule_id": "custom.rule.v1",
      "description": "No system whose risk tier is classed as prohibited is deployed.",
      "effect": "deny",
      "condition": "for deploy, system.risk_tier equals prohibited",
      "failure_mode": "A system in a prohibited-practice class reaches production.",
      "enforcement_points": [
        "pre_merge",
        "deploy"
      ],
      "implementation": {
        "engine": "opa_rego",
        "module": "policies/pc-custom-rule.rego",
        "entrypoint": "data.aige.cards.pc_custom_rule.verdict"
      },
      "maps_to": [
        "AIGE-OBL-EUAIA-ART5"
      ]
    }
  ],
  "exceptions": "Requested by the system owner, approved by the AI governance committee for at most 90 days, and recorded as a signed verdict override with an expiry.",
  "effective_from": "2026-10-01",
  "review_by": "2027-04-01",
  "extensions": {
    "generated_by": "https://aigovernanceengineer.com/toolkit/policy-card",
    "template": "custom",
    "notice": "Illustrative, review before use. Indicative, not legal advice and not a conformity claim.",
    "cedar_module": "policies/pc-custom-rule.cedar",
    "ci_hook": ".github/workflows/policy-card-pc-custom-rule.yml",
    "approval_pending_from": "ai-governance-committee"
  }
}
